Cites,Authors,Title,Year,Source,Publisher,ArticleURL,CitesURL,GSRank,QueryDate,Type,DOI,ISSN,CitationURL,Volume,Issue,StartPage,EndPage,ECC,CitesPerYear,CitesPerAuthor,AuthorCount,Age,Abstract,FullTextURL,RelatedURL
2,"A Katner, E LeCompte, C Stallard, I Walsh, K Brisolara","Traffic Related Pollutants and Human Health within the I-10 Claiborne Corridor, New Orleans LA: Land Use Implications",2019,"","cnu.org","https://www.cnu.org/sites/default/files/Claiborne%20Corridor%20Report_KATNER_05042019.pdf","https://scholar.google.com/scholar?cites=16608281987779146235&as_sdt=2005&sciodt=2007&hl=en",17,"2025-09-15 08:07:30","PDF","","","",,,,,2,0.33,0,5,6,"… In addition, EJ Screen provides environmental justice indexes (expressed as … A preliminary review of EPA’s NATA and EJ Screen data revealed potential problems with levels of diesel …","https://www.cnu.org/sites/default/files/Claiborne%20Corridor%20Report_KATNER_05042019.pdf","https://scholar.google.com/scholar?q=related:-zEYM3l4fOYJ:scholar.google.com/&scioq=%22ejscreen%22%7C%22epa+ejscreen%22%7C%22environmental+justice+screening+and+mapping+tool%22%7C%22epa+ej+screen%22%7C%22ej+screen%22%7C%22epa+environmental+justice+mapping+tool%22%7C%22environmental+justice+screening+tool+epa%22%7C%22ejscreen+v2.0%22%7C%22ejscreen+2020%22%7C%22ejscreen+2022%22&hl=en&as_sdt=2007&as_ylo=2015&as_yhi=2020"
0,"C Ajmera, K Dubytz, E Lih, S Rahman, J Six","Embedding Environmental Justice into the Washington State Department of Ecology: Promising Practices for Advancing Equity and Environmental Justice",2020,"","digital.lib.washington.edu","https://digital.lib.washington.edu/researchworks/items/98cef328-d72a-4d79-bd70-8aaac35eba9a","",20,"2025-09-15 08:07:30","","","","",,,,,0,0.00,0,5,5,"The purpose of this report is to equip the Washington State Department of Ecology (Ecology) with evidence-based recommendations to further equity and environmental justice (EJ) …","https://digital.lib.washington.edu/bitstreams/fd1a9a18-dbc9-4c0b-afba-9d5258f9ff34/download","https://scholar.google.com/scholar?q=related:_RVX-g9I6JYJ:scholar.google.com/&scioq=%22ejscreen%22%7C%22epa+ejscreen%22%7C%22environmental+justice+screening+and+mapping+tool%22%7C%22epa+ej+screen%22%7C%22ej+screen%22%7C%22epa+environmental+justice+mapping+tool%22%7C%22environmental+justice+screening+tool+epa%22%7C%22ejscreen+v2.0%22%7C%22ejscreen+2020%22%7C%22ejscreen+2022%22&hl=en&as_sdt=2007&as_ylo=2015&as_yhi=2020"
0,"E Moon","Permittee and Mailing Address: Department of the Navy Naval Base Guam (NBG) PSC 455, Box 152 FPO AP, Guam 96540-1000 Permitted Facility and …",2019,"","epa.gov","https://www.epa.gov/system/files/documents/2023-02/gus040000-naval-base-guam-ms4-permit-mod-fs-2022-12-15.pdf","",22,"2025-09-15 08:07:30","PDF","","","",,,,,0,0.00,0,1,6,"EPA, Region 9 is making a minor modification of the National Pollutant Discharge Elimination System (NPDES) permit for discharges from the municipal separate storm sewer systems (…","https://www.epa.gov/system/files/documents/2023-02/gus040000-naval-base-guam-ms4-permit-mod-fs-2022-12-15.pdf","https://scholar.google.com/scholar?q=related:jc-UIbmapZwJ:scholar.google.com/&scioq=%22ejscreen%22%7C%22epa+ejscreen%22%7C%22environmental+justice+screening+and+mapping+tool%22%7C%22epa+ej+screen%22%7C%22ej+screen%22%7C%22epa+environmental+justice+mapping+tool%22%7C%22environmental+justice+screening+tool+epa%22%7C%22ejscreen+v2.0%22%7C%22ejscreen+2020%22%7C%22ejscreen+2022%22&hl=en&as_sdt=2007&as_ylo=2015&as_yhi=2020"
61,"EA Bradshaw","Tombstone towns and toxic prisons: prison ecology and the necessity of an anti-prison environmental movement",2018,"Critical Criminology","Springer","https://link.springer.com/article/10.1007/s10612-018-9399-6","https://scholar.google.com/scholar?cites=10041719730797993047&as_sdt=2005&sciodt=2007&hl=en",15,"2025-09-15 08:07:30","","10.1007/s10612-018-9399-6","","",,,,,61,8.71,61,1,7,"Within the field of green criminology, scant attention has been paid to prison ecology, or the unique characteristics of the common environments of correctional facilities. As investigative …","","https://scholar.google.com/scholar?q=related:V9w-UORaW4sJ:scholar.google.com/&scioq=%22ejscreen%22%7C%22epa+ejscreen%22%7C%22environmental+justice+screening+and+mapping+tool%22%7C%22epa+ej+screen%22%7C%22ej+screen%22%7C%22epa+environmental+justice+mapping+tool%22%7C%22environmental+justice+screening+tool+epa%22%7C%22ejscreen+v2.0%22%7C%22ejscreen+2020%22%7C%22ejscreen+2022%22&hl=en&as_sdt=2007&as_ylo=2015&as_yhi=2020"
0,"EPE Center","NEXTera®",2020,"","garnetenergycenter.com","https://www.garnetenergycenter.com/wp-content/uploads/2021/03/Appendix-C_PIP-Plan.pdf","",14,"2025-09-15 08:07:30","PDF","","","",,,,,0,0.00,0,1,5,"Garnet Energy Center, LLC, a wholly-owned indirect subsidiary of NextEra Energy Resources, LLC (“NextEra Energy Resources”), plans to submit an application to construct a major …","https://www.garnetenergycenter.com/wp-content/uploads/2021/03/Appendix-C_PIP-Plan.pdf","https://scholar.google.com/scholar?q=related:cN7BHzF1yPwJ:scholar.google.com/&scioq=%22ejscreen%22%7C%22epa+ejscreen%22%7C%22environmental+justice+screening+and+mapping+tool%22%7C%22epa+ej+screen%22%7C%22ej+screen%22%7C%22epa+environmental+justice+mapping+tool%22%7C%22environmental+justice+screening+tool+epa%22%7C%22ejscreen+v2.0%22%7C%22ejscreen+2020%22%7C%22ejscreen+2022%22&hl=en&as_sdt=2007&as_ylo=2015&as_yhi=2020"
2,"F Morales III, M Parmer","Implementing SB 1000: Policy Strategies for Local Governments",2018,"University of California, Riverside","spp.ucr.edu","https://spp.ucr.edu/sites/g/files/rcwecm1611/files/2020-11/Capstone%20Paper%20-%20Morales%20and%20Parmer%206%2011%202018.pdf","https://scholar.google.com/scholar?cites=620689551001428744&as_sdt=2005&sciodt=2007&hl=en",10,"2025-09-15 08:07:30","PDF","","","",,,,,2,0.29,1,2,7,"This paper looks at the City of Riverside’s (City) previous General Plan update in 2007 to determine the extent that it addressed environmental justice (EJ). It then looks at the recent …","https://spp.ucr.edu/sites/g/files/rcwecm1611/files/2020-11/Capstone%20Paper%20-%20Morales%20and%20Parmer%206%2011%202018.pdf","https://scholar.google.com/scholar?q=related:CKM8q9shnQgJ:scholar.google.com/&scioq=%22ejscreen%22%7C%22epa+ejscreen%22%7C%22environmental+justice+screening+and+mapping+tool%22%7C%22epa+ej+screen%22%7C%22ej+screen%22%7C%22epa+environmental+justice+mapping+tool%22%7C%22environmental+justice+screening+tool+epa%22%7C%22ejscreen+v2.0%22%7C%22ejscreen+2020%22%7C%22ejscreen+2022%22&hl=en&as_sdt=2007&as_ylo=2015&as_yhi=2020"
0,"FR VI","Bayou Sara Streambank Stabilization",2018,"","","","",28,"2025-09-15 08:07:30","CITATION","","","",,,,,0,0.00,0,1,7,"","","https://scholar.google.com/scholar?q=related:QtT0JcaPr1sJ:scholar.google.com/&scioq=%22ejscreen%22%7C%22epa+ejscreen%22%7C%22environmental+justice+screening+and+mapping+tool%22%7C%22epa+ej+screen%22%7C%22ej+screen%22%7C%22epa+environmental+justice+mapping+tool%22%7C%22environmental+justice+screening+tool+epa%22%7C%22ejscreen+v2.0%22%7C%22ejscreen+2020%22%7C%22ejscreen+2022%22&hl=en&as_sdt=2007&as_ylo=2015&as_yhi=2020"
14,"G CITY, CW PLAN","Philadelphia's",2016,"Copeland, C","arch.umd.edu","https://arch.umd.edu/sites/default/files/docs/PA_Green%20City%20Clean%20Waters_FINAL.pdf","https://scholar.google.com/scholar?cites=2279747956669724047&as_sdt=2005&sciodt=2007&hl=en",25,"2025-09-15 08:07:30","PDF","","","",,,,,14,1.56,7,2,9,"This appendix is a response to one of the original research questions for this project:“Question 3. Are there policy changes needed to better realize community benefits and ensure …","https://arch.umd.edu/sites/default/files/docs/PA_Green%20City%20Clean%20Waters_FINAL.pdf","https://scholar.google.com/scholar?q=related:j7W4HrBKox8J:scholar.google.com/&scioq=%22ejscreen%22%7C%22epa+ejscreen%22%7C%22environmental+justice+screening+and+mapping+tool%22%7C%22epa+ej+screen%22%7C%22ej+screen%22%7C%22epa+environmental+justice+mapping+tool%22%7C%22environmental+justice+screening+tool+epa%22%7C%22ejscreen+v2.0%22%7C%22ejscreen+2020%22%7C%22ejscreen+2022%22&hl=en&as_sdt=2007&as_ylo=2015&as_yhi=2020"
0,"GRD Authority","Subject: Scoping Document 1 for the Pensacola Hydroelectric Project",2018,"","grda.com","https://www.grda.com/wp-content/uploads/2019/04/Scoping-Document-2.pdf","",26,"2025-09-15 08:07:30","PDF","","","",,,,,0,0.00,0,1,7,"… Response: An analysis of the project area using the EPA’s EJSCREEN tool indicates the presence of environmental justice communities in the vicinity of the project. The scoping …","https://www.grda.com/wp-content/uploads/2019/04/Scoping-Document-2.pdf","https://scholar.google.com/scholar?q=related:Ee22cdRHBr0J:scholar.google.com/&scioq=%22ejscreen%22%7C%22epa+ejscreen%22%7C%22environmental+justice+screening+and+mapping+tool%22%7C%22epa+ej+screen%22%7C%22ej+screen%22%7C%22epa+environmental+justice+mapping+tool%22%7C%22environmental+justice+screening+tool+epa%22%7C%22ejscreen+v2.0%22%7C%22ejscreen+2020%22%7C%22ejscreen+2022%22&hl=en&as_sdt=2007&as_ylo=2015&as_yhi=2020"
4,"H Kryczka, N Ospina, T Thomas","New Steps Toward Environmental Justice: The California Coastal Act and Environmental Justice near Ports",2020,"Sw. L. Rev.","HeinOnline","https://heinonline.org/hol-cgi-bin/get_pdf.cgi?handle=hein.journals/swulr50&section=31","https://scholar.google.com/scholar?cites=9530299112420584754&as_sdt=2005&sciodt=2007&hl=en",13,"2025-09-15 08:07:30","","","","",,,,,4,0.80,1,3,5,"California's coast is home to several seaports of varying sizes, each with an individual history of development and community advocacy deserving of its own article. One thing ports tend …","http://rss.swlaw.edu/sites/default/files/2022-09/5%20_Kryczka%20Ospina%20Thomas%20Article.pdf","https://scholar.google.com/scholar?q=related:Mq0Mj4xsQoQJ:scholar.google.com/&scioq=%22ejscreen%22%7C%22epa+ejscreen%22%7C%22environmental+justice+screening+and+mapping+tool%22%7C%22epa+ej+screen%22%7C%22ej+screen%22%7C%22epa+environmental+justice+mapping+tool%22%7C%22environmental+justice+screening+tool+epa%22%7C%22ejscreen+v2.0%22%7C%22ejscreen+2020%22%7C%22ejscreen+2022%22&hl=en&as_sdt=2007&as_ylo=2015&as_yhi=2020"
15,"J Ji, L Hu, B Liu, Y Li","Identifying and assessing the impact of key neighborhood-level determinants on geographic variation in stroke: a machine learning and multilevel modeling …",2020,"BMC Public Health","Springer","https://link.springer.com/article/10.1186/s12889-020-09766-3","https://scholar.google.com/scholar?cites=17600671416977153089&as_sdt=2005&sciodt=2007&hl=en",6,"2025-09-15 08:07:30","HTML","10.1186/s12889-020-09766-3","","",,,,,15,3.00,4,4,5,"… The EPA’s Environmental Justice Screening (EJSCREEN) database is also publicly available on the website, https://www.epa.gov/ejscreen/download-ejscreen-data [19]. …","https://link.springer.com/article/10.1186/s12889-020-09766-3","https://scholar.google.com/scholar?q=related:QVxLwWYlQvQJ:scholar.google.com/&scioq=%22ejscreen%22%7C%22epa+ejscreen%22%7C%22environmental+justice+screening+and+mapping+tool%22%7C%22epa+ej+screen%22%7C%22ej+screen%22%7C%22epa+environmental+justice+mapping+tool%22%7C%22environmental+justice+screening+tool+epa%22%7C%22ejscreen+v2.0%22%7C%22ejscreen+2020%22%7C%22ejscreen+2022%22&hl=en&as_sdt=2007&as_ylo=2015&as_yhi=2020"
126,"J Lee, J Byrne","Expanding the conceptual and analytical basis of energy justice: beyond the three-tenet framework",2019,"Frontiers in Energy Research","frontiersin.org","https://www.frontiersin.org/articles/10.3389/fenrg.2019.00099/full","https://scholar.google.com/scholar?cites=5397982146609398379&as_sdt=2005&sciodt=2007&hl=en",5,"2025-09-15 08:07:30","HTML","10.3389/fenrg.2019.00099","","",,,,,126,21.00,63,2,6,"Energy justice is now an established research topic in the field of energy policy. Despite the growing popularity of energy justice research, however, conceptual and analytical …","https://www.frontiersin.org/articles/10.3389/fenrg.2019.00099/full","https://scholar.google.com/scholar?q=related:a8KNoCl86UoJ:scholar.google.com/&scioq=%22ejscreen%22%7C%22epa+ejscreen%22%7C%22environmental+justice+screening+and+mapping+tool%22%7C%22epa+ej+screen%22%7C%22ej+screen%22%7C%22epa+environmental+justice+mapping+tool%22%7C%22environmental+justice+screening+tool+epa%22%7C%22ejscreen+v2.0%22%7C%22ejscreen+2020%22%7C%22ejscreen+2022%22&hl=en&as_sdt=2007&as_ylo=2015&as_yhi=2020"
72,"J Liang, S Park, T Zhao","Representative bureaucracy, distributional equity, and environmental justice",2020,"Public Administration Review","Wiley Online Library","https://onlinelibrary.wiley.com/doi/abs/10.1111/puar.13160","https://scholar.google.com/scholar?cites=18225983260635955263&as_sdt=2005&sciodt=2007&hl=en",2,"2025-09-15 08:07:30","","10.1111/puar.13160","","",,,,,72,14.40,24,3,5,"… of EJSCREEN, which is an environmental justice screening and mapping tool developed by … We specifically rely on the 2016 version of EJSCREEN, in which demographic (social …","https://scholarworks.indianapolis.iu.edu/bitstreams/dd2d0d29-4140-4643-a068-c5a6b3223a17/download","https://scholar.google.com/scholar?q=related:PwBszDWz7_wJ:scholar.google.com/&scioq=%22ejscreen%22%7C%22epa+ejscreen%22%7C%22environmental+justice+screening+and+mapping+tool%22%7C%22epa+ej+screen%22%7C%22ej+screen%22%7C%22epa+environmental+justice+mapping+tool%22%7C%22environmental+justice+screening+tool+epa%22%7C%22ejscreen+v2.0%22%7C%22ejscreen+2020%22%7C%22ejscreen+2022%22&hl=en&as_sdt=2007&as_ylo=2015&as_yhi=2020"
0,"J Parfrey, C Resolve","Stakeholder Interviewees",,"climateresolve.org","","https://climateresolve.org/wp-content/uploads/2021/08/Ready-For-Tomorrow-SCE-Report-1.pdf","",11,"2025-09-15 08:07:30","PDF","","","",,,,,0,0.00,0,2,,"… has not adopted an LHMP by January 1, 2022, it must incorporate climate adaptation into the … Smart Cities Los Angeles tool and EPA EJScreen for its climate vulnerability assessment. …","https://climateresolve.org/wp-content/uploads/2021/08/Ready-For-Tomorrow-SCE-Report-1.pdf","https://scholar.google.com/scholar?q=related:AVEtqBjUC-QJ:scholar.google.com/&scioq=%22ejscreen%22%7C%22epa+ejscreen%22%7C%22environmental+justice+screening+and+mapping+tool%22%7C%22epa+ej+screen%22%7C%22ej+screen%22%7C%22epa+environmental+justice+mapping+tool%22%7C%22environmental+justice+screening+tool+epa%22%7C%22ejscreen+v2.0%22%7C%22ejscreen+2020%22%7C%22ejscreen+2022%22&hl=en&as_sdt=2007&as_ylo=2015&as_yhi=2020"
3,"JM Dolloff","Increasing recycling in California: how targeted education and outreach could increase participation and recycling rates in local recycling programs",2017,"","csus.edu","https://www.csus.edu/college/social-sciences-interdisciplinary-studies/public-policy-administration/_internal/_documents/thesis-bank/thesis-bank-2017-dolloff.pdf","https://scholar.google.com/scholar?cites=617752491755260807&as_sdt=2005&sciodt=2007&hl=en",23,"2025-09-15 08:07:30","PDF","","","",,,,,3,0.38,3,1,8,"… which will go into effect on January 1, 2022. However, CalRecycle is encouraging jurisdictions to … One is US EJ Screen, which is an environmental justice mapping tool developed by US …","https://www.csus.edu/college/social-sciences-interdisciplinary-studies/public-policy-administration/_internal/_documents/thesis-bank/thesis-bank-2017-dolloff.pdf","https://scholar.google.com/scholar?q=related:h0svRp6ykggJ:scholar.google.com/&scioq=%22ejscreen%22%7C%22epa+ejscreen%22%7C%22environmental+justice+screening+and+mapping+tool%22%7C%22epa+ej+screen%22%7C%22ej+screen%22%7C%22epa+environmental+justice+mapping+tool%22%7C%22environmental+justice+screening+tool+epa%22%7C%22ejscreen+v2.0%22%7C%22ejscreen+2020%22%7C%22ejscreen+2022%22&hl=en&as_sdt=2007&as_ylo=2015&as_yhi=2020"
0,"KJ Lynch, E Lamair, E Healey","Climate Policy &Environmental Justice Recommendations for Colorado: Environmental Justice and the Climate Action Plan to Reduce Pollution",2020,"","digitalcommons.du.edu","https://digitalcommons.du.edu/law_facpub/465/","",21,"2025-09-15 08:07:30","","","","",,,,,0,0.00,0,3,5,"This report was primarily drafted in the Spring of 2019, as the Colorado Legislature considered, and ultimately enacted, HB 19-1261. Since that time, developments have only …","https://digitalcommons.du.edu/cgi/viewcontent.cgi?article=1465&context=law_facpub","https://scholar.google.com/scholar?q=related:D6JWT826ACAJ:scholar.google.com/&scioq=%22ejscreen%22%7C%22epa+ejscreen%22%7C%22environmental+justice+screening+and+mapping+tool%22%7C%22epa+ej+screen%22%7C%22ej+screen%22%7C%22epa+environmental+justice+mapping+tool%22%7C%22environmental+justice+screening+tool+epa%22%7C%22ejscreen+v2.0%22%7C%22ejscreen+2020%22%7C%22ejscreen+2022%22&hl=en&as_sdt=2007&as_ylo=2015&as_yhi=2020"
7,"LG Fields","Mercy mercy me, a (climate) change is going to come",2016,"The Black Scholar","Taylor &Francis","https://www.tandfonline.com/doi/abs/10.1080/00064246.2016.1188360","https://scholar.google.com/scholar?cites=8748601624887640410&as_sdt=2005&sciodt=2007&hl=en",29,"2025-09-15 08:07:30","","10.1080/00064246.2016.1188360","","",,,,,7,0.78,7,1,9,"… The EPA conducted a proximity analysis using EJSCREEN, its newest screening and data … Even though states are required to begin compliance in 2022, power plants can get credit for …","","https://scholar.google.com/scholar?q=related:WkHVZNNGaXkJ:scholar.google.com/&scioq=%22ejscreen%22%7C%22epa+ejscreen%22%7C%22environmental+justice+screening+and+mapping+tool%22%7C%22epa+ej+screen%22%7C%22ej+screen%22%7C%22epa+environmental+justice+mapping+tool%22%7C%22environmental+justice+screening+tool+epa%22%7C%22ejscreen+v2.0%22%7C%22ejscreen+2020%22%7C%22ejscreen+2022%22&hl=en&as_sdt=2007&as_ylo=2015&as_yhi=2020"
2,"M Baumhefner, R Hwang, P Bull","Driving out pollution",2016,"","chargevc.org","https://chargevc.org/wp-content/uploads/2017/12/NRDC-Driving-Out-Pollution-How-Utilities-Can-Accelerate-the-Market-for-EVs.pdf","https://scholar.google.com/scholar?cites=13345132139222757585&as_sdt=2005&sciodt=2007&hl=en",32,"2025-09-15 08:07:30","PDF","","","",,,,,2,0.22,1,3,9,"As noted in a recent National Academies of Science study, only utilities can capture the “incremental revenue from additional electricity that EV drivers consume at home, where roughly …","https://chargevc.org/wp-content/uploads/2017/12/NRDC-Driving-Out-Pollution-How-Utilities-Can-Accelerate-the-Market-for-EVs.pdf","https://scholar.google.com/scholar?q=related:0XAFn_luM7kJ:scholar.google.com/&scioq=%22ejscreen%22%7C%22epa+ejscreen%22%7C%22environmental+justice+screening+and+mapping+tool%22%7C%22epa+ej+screen%22%7C%22ej+screen%22%7C%22epa+environmental+justice+mapping+tool%22%7C%22environmental+justice+screening+tool+epa%22%7C%22ejscreen+v2.0%22%7C%22ejscreen+2020%22%7C%22ejscreen+2022%22&hl=en&as_sdt=2007&as_ylo=2015&as_yhi=2020"
10,"M Ramirez-Andreotta","Engaging with ethnically diverse community groups",2018,"Environmental health literacy","Springer","https://link.springer.com/chapter/10.1007/978-3-319-94108-0_4","https://scholar.google.com/scholar?cites=4339790170753724987&as_sdt=2005&sciodt=2007&hl=en",4,"2025-09-15 08:07:30","","10.1007/978-3-319-94108-0_4","","",,,,,10,1.43,10,1,7,"… As illustrated by the EJ SCREEN and the publications cited above, in the United States, people of … EJ SCREEN is one way to visualize sources of pollution and who may be impacted. …","https://dlib.scu.ac.ir/bitstream/Hannan/236205/1/9783319941073.pdf#page=78","https://scholar.google.com/scholar?q=related:O_KBxyoIOjwJ:scholar.google.com/&scioq=%22ejscreen%22%7C%22epa+ejscreen%22%7C%22environmental+justice+screening+and+mapping+tool%22%7C%22epa+ej+screen%22%7C%22ej+screen%22%7C%22epa+environmental+justice+mapping+tool%22%7C%22environmental+justice+screening+tool+epa%22%7C%22ejscreen+v2.0%22%7C%22ejscreen+2020%22%7C%22ejscreen+2022%22&hl=en&as_sdt=2007&as_ylo=2015&as_yhi=2020"
0,"MC Bathula","Environmental Justice: A GIS-based analysis in the State of Ohio, USA based on Indoor Radon Concentrations",2020,"","search.proquest.com","https://search.proquest.com/openview/b31064a71ec60aa44b5b77ed76f73470/1?pq-origsite=gscholar&cbl=18750&diss=y","",1,"2025-09-15 08:07:30","BOOK","","","",,,,,0,0.00,0,1,5,"… The demographic index in EJSCREEN is calculated using two demographic indicators minority and low-income. For a given census block group demographic index is obtained by …","https://etd.ohiolink.edu/acprod/odb_etd/ws/send_file/send?accession=toledo160711124342292&disposition=inline","https://scholar.google.com/scholar?q=related:w_UmTGXFBj8J:scholar.google.com/&scioq=%22ejscreen%22%7C%22epa+ejscreen%22%7C%22environmental+justice+screening+and+mapping+tool%22%7C%22epa+ej+screen%22%7C%22ej+screen%22%7C%22epa+environmental+justice+mapping+tool%22%7C%22environmental+justice+screening+tool+epa%22%7C%22ejscreen+v2.0%22%7C%22ejscreen+2020%22%7C%22ejscreen+2022%22&hl=en&as_sdt=2007&as_ylo=2015&as_yhi=2020"
8,"MR Greenberg","Siting noxious facilities: Integrating location economics and risk analysis to protect environmental health and investments",2018,"","taylorfrancis.com","https://www.taylorfrancis.com/books/mono/10.4324/9781315104034/siting-noxious-facilities-michael-greenberg","https://scholar.google.com/scholar?cites=6261940698777435652&as_sdt=2005&sciodt=2007&hl=en",16,"2025-09-15 08:07:30","BOOK","10.4324/9781315104034","","",,,,,8,1.14,8,1,7,"… and 2021 and 2.7% from 2022 through 2026. These estimates … EPA’s relatively new EJScreen database (type in EJScreen) … for this book, I used EJScreen and other databases to learn …","","https://scholar.google.com/scholar?q=related:BL4wa-Ph5lYJ:scholar.google.com/&scioq=%22ejscreen%22%7C%22epa+ejscreen%22%7C%22environmental+justice+screening+and+mapping+tool%22%7C%22epa+ej+screen%22%7C%22ej+screen%22%7C%22epa+environmental+justice+mapping+tool%22%7C%22environmental+justice+screening+tool+epa%22%7C%22ejscreen+v2.0%22%7C%22ejscreen+2020%22%7C%22ejscreen+2022%22&hl=en&as_sdt=2007&as_ylo=2015&as_yhi=2020"
1,"N Hart, D D'arcy","Meaningful Transparency At EPA: A Framework for Rationalizing Approaches to Promote Open Science and Data Sharing for Evidence-Based Policymaking",2019,"Available at SSRN 3782804","papers.ssrn.com","https://papers.ssrn.com/sol3/papers.cfm?abstract_id=3782804","https://scholar.google.com/scholar?cites=12378769068451462622&as_sdt=2005&sciodt=2007&hl=en",30,"2025-09-15 08:07:30","","","","",,,,,1,0.17,1,2,6,"… EPA’s 2018-2022 strategic plan established three goals for achieving its mission in the … In 2018, EPA launched EJSCREEN, an environmental-justice mapping and screening tool that …","https://papers.ssrn.com/sol3/Delivery.cfm?abstractid=3782804","https://scholar.google.com/scholar?q=related:3n2k2eE4yqsJ:scholar.google.com/&scioq=%22ejscreen%22%7C%22epa+ejscreen%22%7C%22environmental+justice+screening+and+mapping+tool%22%7C%22epa+ej+screen%22%7C%22ej+screen%22%7C%22epa+environmental+justice+mapping+tool%22%7C%22environmental+justice+screening+tool+epa%22%7C%22ejscreen+v2.0%22%7C%22ejscreen+2020%22%7C%22ejscreen+2022%22&hl=en&as_sdt=2007&as_ylo=2015&as_yhi=2020"
79,"N Maizlish, T Delaney, H Dowling, ...","California healthy places index: frames matter",2019,"Public Health …","journals.sagepub.com","https://journals.sagepub.com/doi/abs/10.1177/0033354919849882","https://scholar.google.com/scholar?cites=8262169131454235791&as_sdt=2005&sciodt=2007&hl=en",19,"2025-09-15 08:07:30","","10.1177/0033354919849882","","",,,,,79,13.17,20,4,6,"Introduction: We describe the California Healthy Places Index (HPI) and its performance relative to other indexes for measuring community well-being at the census-tract level. The HPI …","https://journals.sagepub.com/doi/full/10.1177/0033354919849882","https://scholar.google.com/scholar?q=related:jwSH2gwfqXIJ:scholar.google.com/&scioq=%22ejscreen%22%7C%22epa+ejscreen%22%7C%22environmental+justice+screening+and+mapping+tool%22%7C%22epa+ej+screen%22%7C%22ej+screen%22%7C%22epa+environmental+justice+mapping+tool%22%7C%22environmental+justice+screening+tool+epa%22%7C%22ejscreen+v2.0%22%7C%22ejscreen+2020%22%7C%22ejscreen+2022%22&hl=en&as_sdt=2007&as_ylo=2015&as_yhi=2020"
0,"P BOARD","South Jersey Transportation Planning Organization",2016,"","sjtpo.org","https://sjtpo.org/wp-content/uploads/2021/04/Policy-Board-Agenda_April-2021.pdf","",24,"2025-09-15 08:07:30","PDF","","","",,,,,0,0.00,0,1,9,"… As the FFY 2022-2025 Local Lead projects and associated … the new Federal Fiscal Year (FFY) 2022-2031 TIP and plans to bring the … The FFY 2022-2031 TIP is underway with adoption …","https://sjtpo.org/wp-content/uploads/2021/04/Policy-Board-Agenda_April-2021.pdf","https://scholar.google.com/scholar?q=related:0Y8M-PaJRUgJ:scholar.google.com/&scioq=%22ejscreen%22%7C%22epa+ejscreen%22%7C%22environmental+justice+screening+and+mapping+tool%22%7C%22epa+ej+screen%22%7C%22ej+screen%22%7C%22epa+environmental+justice+mapping+tool%22%7C%22environmental+justice+screening+tool+epa%22%7C%22ejscreen+v2.0%22%7C%22ejscreen+2020%22%7C%22ejscreen+2022%22&hl=en&as_sdt=2007&as_ylo=2015&as_yhi=2020"
