Cites,Authors,Title,Year,Source,Publisher,ArticleURL,CitesURL,GSRank,QueryDate,Type,DOI,ISSN,CitationURL,Volume,Issue,StartPage,EndPage,ECC,CitesPerYear,CitesPerAuthor,AuthorCount,Age,Abstract,FullTextURL,RelatedURL
5,"RL Bentlyewski, M Juhn","Race, Place, and Pollution: The Deep Roots of Environmental Racism",2020,"Fordham L. Rev. Online","HeinOnline","https://heinonline.org/hol-cgi-bin/get_pdf.cgi?handle=hein.journals/resgest11&section=18","https://scholar.google.com/scholar?cites=16227888168373110425&as_sdt=2005&sciodt=2007&hl=en",8,"2025-09-15 08:07:30","","","","",,,,,5,1.00,3,2,5,"… EJSCREEN to inform outreach and engagement practices, develop retrospective reports of EPA work, and enhance geographically based initiatives. The EPA does not use EJSCREEN …","","https://scholar.google.com/scholar?q=related:mcakYk8KNeEJ:scholar.google.com/&scioq=%22ejscreen%22%7C%22epa+ejscreen%22%7C%22environmental+justice+screening+and+mapping+tool%22%7C%22epa+ej+screen%22%7C%22ej+screen%22%7C%22epa+environmental+justice+mapping+tool%22%7C%22environmental+justice+screening+tool+epa%22%7C%22ejscreen+v2.0%22%7C%22ejscreen+2020%22%7C%22ejscreen+2022%22&hl=en&as_sdt=2007&as_ylo=2015&as_yhi=2020"
0,"RL Bentlyewski, M Juhn","Systemic Inequality| Race, Place, and Pollution: The Deep Roots of Environmental Racism",2020,"Fordham Law Review Online","ir.lawnet.fordham.edu","https://ir.lawnet.fordham.edu/cgi/viewcontent.cgi?article=1084&context=flro","",9,"2025-09-15 08:07:30","PDF","","","",,,,,0,0.00,0,2,5,"… EJSCREEN to inform outreach and engagement practices, develop retrospective reports of EPA work, and enhance geographically based initiatives. The EPA does not use EJSCREEN …","https://ir.lawnet.fordham.edu/cgi/viewcontent.cgi?article=1084&context=flro","https://scholar.google.com/scholar?q=related:kvzI2yi7QwwJ:scholar.google.com/&scioq=%22ejscreen%22%7C%22epa+ejscreen%22%7C%22environmental+justice+screening+and+mapping+tool%22%7C%22epa+ej+screen%22%7C%22ej+screen%22%7C%22epa+environmental+justice+mapping+tool%22%7C%22environmental+justice+screening+tool+epa%22%7C%22ejscreen+v2.0%22%7C%22ejscreen+2020%22%7C%22ejscreen+2022%22&hl=en&as_sdt=2007&as_ylo=2015&as_yhi=2020"
6,"S Index","Methodology report",2016,"Milwaukee, WI","piercecounty.caimaps.info","https://piercecounty.caimaps.info/cailive/Content/orgs/PierceCounty/documents/CAI_Pierce_IndexMethodologyReport_2024.pdf","https://scholar.google.com/scholar?cites=10882719112570467063&as_sdt=2005&sciodt=2007&hl=en",7,"2025-09-15 08:07:30","PDF","","","",,,,,6,0.67,6,1,9,"… ▪ The Average Life Expectancy metric was changed to Percent Low Life Expectancy and the source was updated to EPA’s EJScreen data source due to newer data and more frequent …","https://piercecounty.caimaps.info/cailive/Content/orgs/PierceCounty/documents/CAI_Pierce_IndexMethodologyReport_2024.pdf","https://scholar.google.com/scholar?q=related:9_Idr18vB5cJ:scholar.google.com/&scioq=%22ejscreen%22%7C%22epa+ejscreen%22%7C%22environmental+justice+screening+and+mapping+tool%22%7C%22epa+ej+screen%22%7C%22ej+screen%22%7C%22epa+environmental+justice+mapping+tool%22%7C%22environmental+justice+screening+tool+epa%22%7C%22ejscreen+v2.0%22%7C%22ejscreen+2020%22%7C%22ejscreen+2022%22&hl=en&as_sdt=2007&as_ylo=2015&as_yhi=2020"
22,"S Sandhaus, MD Ramírez-Andreotta, ...","Combating climate injustices: An informal science and popular education approach to addressing environmental health disparities",2018,"Pedagogy in Health …","journals.sagepub.com","https://journals.sagepub.com/doi/abs/10.1177/2373379917751476","https://scholar.google.com/scholar?cites=5665300701690443826&as_sdt=2005&sciodt=2007&hl=en",18,"2025-09-15 08:07:30","","10.1177/2373379917751476","","",,,,,22,3.14,7,3,7,"As global warming worsens, addressing environmental health disparities and justice is increasingly important. This necessity is evident in southern metropolitan Tucson, Arizona, an …","https://pmc.ncbi.nlm.nih.gov/articles/PMC8443210/pdf/nihms-1068313.pdf","https://scholar.google.com/scholar?q=related:MrgH3vgwn04J:scholar.google.com/&scioq=%22ejscreen%22%7C%22epa+ejscreen%22%7C%22environmental+justice+screening+and+mapping+tool%22%7C%22epa+ej+screen%22%7C%22ej+screen%22%7C%22epa+environmental+justice+mapping+tool%22%7C%22environmental+justice+screening+tool+epa%22%7C%22ejscreen+v2.0%22%7C%22ejscreen+2020%22%7C%22ejscreen+2022%22&hl=en&as_sdt=2007&as_ylo=2015&as_yhi=2020"
1,"SL Davis, N Perez, S Koester","Forests Are Not Fuel",2019,"Reference Module in …","media.dogwoodalliance.org","https://media.dogwoodalliance.org/wp-content/uploads/2022/11/davis2019-Forests-Are-Not-Fuel.pdf","https://scholar.google.com/scholar?cites=18239178220648895188&as_sdt=2005&sciodt=2007&hl=en",27,"2025-09-15 08:07:30","PDF","","","",,,,,1,0.17,0,3,6,"As the world seeks solutions to climate change, and in light of the 2015 Paris Climate Agreement, attempts to decarbonize the electric power sector by 2050, a primitive form of energy …","https://media.dogwoodalliance.org/wp-content/uploads/2022/11/davis2019-Forests-Are-Not-Fuel.pdf","https://scholar.google.com/scholar?q=related:1JLR1PSTHv0J:scholar.google.com/&scioq=%22ejscreen%22%7C%22epa+ejscreen%22%7C%22environmental+justice+screening+and+mapping+tool%22%7C%22epa+ej+screen%22%7C%22ej+screen%22%7C%22epa+environmental+justice+mapping+tool%22%7C%22environmental+justice+screening+tool+epa%22%7C%22ejscreen+v2.0%22%7C%22ejscreen+2020%22%7C%22ejscreen+2022%22&hl=en&as_sdt=2007&as_ylo=2015&as_yhi=2020"
0,"VOFI LAKE","Stormwater Management Program Plan",2016,"","villageofislandlake.com","https://villageofislandlake.com/wp-content/uploads/2018/06/2016-SMPP-Island-Lake-Final.pdf","",31,"2025-09-15 08:07:30","PDF","","","",,,,,0,0.00,0,1,9,"This Stormwater Management Program Plan (SMPP) was developed by the Village based off a SMPP template provided by the Lake County Stormwater Management Commission. The …","https://villageofislandlake.com/wp-content/uploads/2018/06/2016-SMPP-Island-Lake-Final.pdf","https://scholar.google.com/scholar?q=related:_G95jutVtAEJ:scholar.google.com/&scioq=%22ejscreen%22%7C%22epa+ejscreen%22%7C%22environmental+justice+screening+and+mapping+tool%22%7C%22epa+ej+screen%22%7C%22ej+screen%22%7C%22epa+environmental+justice+mapping+tool%22%7C%22environmental+justice+screening+tool+epa%22%7C%22ejscreen+v2.0%22%7C%22ejscreen+2020%22%7C%22ejscreen+2022%22&hl=en&as_sdt=2007&as_ylo=2015&as_yhi=2020"
0,"W Bridge","replacement project",2016,"NSW","vdot.virginia.gov","https://www.vdot.virginia.gov/media/vdotvirginiagov/projects/fredericksburg/robert-o-norris-bridge-replacement-project/Norris-Bridge-EA_November082024_acc_PMnix.pdf","",3,"2025-09-15 08:07:30","PDF","","","",,,,,0,0.00,0,1,9,"The Virginia Department of Transportation is committed to ensuring its electronic documents are accessible to all users. There may be some third-party images, forms, and maps within …","https://www.vdot.virginia.gov/media/vdotvirginiagov/projects/fredericksburg/robert-o-norris-bridge-replacement-project/Norris-Bridge-EA_November082024_acc_PMnix.pdf","https://scholar.google.com/scholar?q=related:uCcepNX_pgkJ:scholar.google.com/&scioq=%22ejscreen%22%7C%22epa+ejscreen%22%7C%22environmental+justice+screening+and+mapping+tool%22%7C%22epa+ej+screen%22%7C%22ej+screen%22%7C%22epa+environmental+justice+mapping+tool%22%7C%22environmental+justice+screening+tool+epa%22%7C%22ejscreen+v2.0%22%7C%22ejscreen+2020%22%7C%22ejscreen+2022%22&hl=en&as_sdt=2007&as_ylo=2015&as_yhi=2020"
0,"배현주, 정다운, 오규림, 김시진","환경정의 구현을 위한 건강위해성 평가 및 관리전략 도입 연구",2020,"기본연구보고서","kiss.kstudy.com","https://kiss.kstudy.com/thesis/thesis-view.asp?key=3880589","",12,"2025-09-15 08:07:30","HTML","","","",,,,,0,0.00,0,4,5,"… (Environmental Justice Screening and Mapping Tool), an environmental justice-based … The EJSCREEN selected 11 environmental indicators and six population indicators and in the …","https://kiss.kstudy.com/thesis/thesis-view.asp?key=3880589","https://scholar.google.com/scholar?q=related:CbdJJcsEp6IJ:scholar.google.com/&scioq=%22ejscreen%22%7C%22epa+ejscreen%22%7C%22environmental+justice+screening+and+mapping+tool%22%7C%22epa+ej+screen%22%7C%22ej+screen%22%7C%22epa+environmental+justice+mapping+tool%22%7C%22environmental+justice+screening+tool+epa%22%7C%22ejscreen+v2.0%22%7C%22ejscreen+2020%22%7C%22ejscreen+2022%22&hl=en&as_sdt=2007&as_ylo=2015&as_yhi=2020"
