Cites,Authors,Title,Year,Source,Publisher,ArticleURL,CitesURL,GSRank,QueryDate,Type,DOI,ISSN,CitationURL,Volume,Issue,StartPage,EndPage,ECC,CitesPerYear,CitesPerAuthor,AuthorCount,Age,Abstract,FullTextURL,RelatedURL
2,"C Huang, A Zhang, M Zhang, ...","Venture capital and vulnerability: Navigating natural disasters and investment resilience",2025,"European Financial …","Wiley Online Library","https://onlinelibrary.wiley.com/doi/abs/10.1111/eufm.12528","https://scholar.google.com/scholar?cites=14289324567282373282&as_sdt=2005&sciodt=2007&hl=en",5,"2025-09-15 07:45:33","","10.1111/eufm.12528","","",,,,,2,2.00,1,4,1,"This study examines the impact of natural disasters on venture capital (VC) investment decisions. Using 47 catastrophic natural disasters occurred in the United States from 1990 to 2019…","https://onlinelibrary.wiley.com/doi/pdfdirect/10.1111/eufm.12528","https://scholar.google.com/scholar?q=related:otIgYfzgTcYJ:scholar.google.com/&scioq=%22future+risk+index%22%7C%22fema+future+risk+index%22%7C%22fri+future+risk+index%22%7C%22fema+fri%22%7C%22fema+climate+risk+index%22%7C%22fema+disaster+risk+index%22%7C%22future+disaster+risk+tool+fema%22%7C%22future+risk+index+fema+prototype%22&hl=en&as_sdt=2007&as_ylo=2024&as_yhi=2025"
0,"D Liu, M Li, L Zhang, M Li, M Faiz, T Li, S Cui, ...","Risk Measurement Analysis of a Regional Water‒Land-Energy-Food Coupling System Under Complex and Uncertain Climate Influences",,"Available at SSRN …","papers.ssrn.com","https://papers.ssrn.com/sol3/papers.cfm?abstract_id=4891409","",3,"2025-09-15 07:45:33","","","","",,,,,0,0.00,0,8,,"… Therefore, when the scenario conditions are worse, the future risk index of the Heilongjiang coupled system is greater. In addition, from a time perspective, the risk indices of the four …","https://papers.ssrn.com/sol3/Delivery.cfm?abstractid=4891409","https://scholar.google.com/scholar?q=related:dTJcE2MPKdoJ:scholar.google.com/&scioq=%22future+risk+index%22%7C%22fema+future+risk+index%22%7C%22fri+future+risk+index%22%7C%22fema+fri%22%7C%22fema+climate+risk+index%22%7C%22fema+disaster+risk+index%22%7C%22future+disaster+risk+tool+fema%22%7C%22future+risk+index+fema+prototype%22&hl=en&as_sdt=2007&as_ylo=2024&as_yhi=2025"
0,"F Yang, C Yang, T Qie, W Wang, ...","Risk Avoidance Decision-Making for Intelligent Vehicles Based on Spatio-Temporal Risk Prediction",2024,"2024 8th CAA …","ieeexplore.ieee.org","https://ieeexplore.ieee.org/abstract/document/10830017/","",1,"2025-09-15 07:45:33","","","","",,,,,0,0.00,0,5,1,"In order to improve the collision risk assessment method of intelligent vehicles in complex traffic scenarios and avoid collision risk in real time, this paper proposes a risk avoidance …","","https://scholar.google.com/scholar?q=related:vDp_rXItLSMJ:scholar.google.com/&scioq=%22future+risk+index%22%7C%22fema+future+risk+index%22%7C%22fri+future+risk+index%22%7C%22fema+fri%22%7C%22fema+climate+risk+index%22%7C%22fema+disaster+risk+index%22%7C%22future+disaster+risk+tool+fema%22%7C%22future+risk+index+fema+prototype%22&hl=en&as_sdt=2007&as_ylo=2024&as_yhi=2025"
4,"JA Velasco, C Luna-Aranguré, ...","Drivers of urban biodiversity in Mexico and joint risks from future urban expansion, climate change, and urban heat island effect",2024,"PLoS …","journals.plos.org","https://journals.plos.org/plosone/article?id=10.1371/journal.pone.0308522","https://scholar.google.com/scholar?cites=9098731931348706879&as_sdt=2005&sciodt=2007&hl=en",4,"2025-09-15 07:45:33","HTML","","","",,,,,4,4.00,1,3,1,"Urbanization is a phenomenon where humans concentrate in high densities and consume more per capita energy than in rural areas, imposing high pressures on biodiversity and …","https://journals.plos.org/plosone/article?id=10.1371/journal.pone.0308522","https://scholar.google.com/scholar?q=related:PyaLAnwwRX4J:scholar.google.com/&scioq=%22future+risk+index%22%7C%22fema+future+risk+index%22%7C%22fri+future+risk+index%22%7C%22fema+fri%22%7C%22fema+climate+risk+index%22%7C%22fema+disaster+risk+index%22%7C%22future+disaster+risk+tool+fema%22%7C%22future+risk+index+fema+prototype%22&hl=en&as_sdt=2007&as_ylo=2024&as_yhi=2025"
0,"L Bonifati","L'altra faccia degli executive orders di Trump: la “guerra ai dati” ei rischi per le future emergenze",2025,"FEDERALISMI. IT","cris.unibo.it","https://cris.unibo.it/handle/11585/1017979","",6,"2025-09-15 07:45:33","","","","",,,,,0,0.00,0,1,1,"L’articolo prende spunto dai recenti executive orders firmati all’inaugurazione della seconda presidenza di Donald Trump e pone l’attenzione sull’attacco ai dati governativi e alla …","https://cris.unibo.it/bitstream/11585/1017979/1/2025-Bonifati-Trump-guerra-dati_Fed.pdf","https://scholar.google.com/scholar?q=related:c-PmRCUY9isJ:scholar.google.com/&scioq=%22future+risk+index%22%7C%22fema+future+risk+index%22%7C%22fri+future+risk+index%22%7C%22fema+fri%22%7C%22fema+climate+risk+index%22%7C%22fema+disaster+risk+index%22%7C%22future+disaster+risk+tool+fema%22%7C%22future+risk+index+fema+prototype%22&hl=en&as_sdt=2007&as_ylo=2024&as_yhi=2025"
1,"L Mahowald, A Shaw","Climate Change Risk for LGBT People in the United States",2024,"","escholarship.org","https://escholarship.org/content/qt7xw635f3/qt7xw635f3.pdf","https://scholar.google.com/scholar?cites=1121889444523494756&as_sdt=2005&sciodt=2007&hl=en",2,"2025-09-15 07:45:33","PDF","","","",,,,,1,1.00,1,2,1,"Climate change represents a global challenge, but it also exacerbates existing disparities among individuals and communities. LGBT people face discrimination and exclusion, creating …","https://escholarship.org/content/qt7xw635f3/qt7xw635f3.pdf","https://scholar.google.com/scholar?q=related:ZE0VeoHAkQ8J:scholar.google.com/&scioq=%22future+risk+index%22%7C%22fema+future+risk+index%22%7C%22fri+future+risk+index%22%7C%22fema+fri%22%7C%22fema+climate+risk+index%22%7C%22fema+disaster+risk+index%22%7C%22future+disaster+risk+tool+fema%22%7C%22future+risk+index+fema+prototype%22&hl=en&as_sdt=2007&as_ylo=2024&as_yhi=2025"
